{
    "authority":  {
                      "runtime":  "flutter",
                      "ci":  "github-actions",
                      "resolvedBy":  "deployment_contract"
                  },
    "contractState":  "INIT",
    "contractHash":  "unknown",
    "previousContractHash":  null,
    "artifact":  {
                     "commitSha":  "92cc591c5757318b5291c211b8938fb57d10bc6e",
                     "buildId":  "unknown",
                     "workflowRunId":  "unknown"
                 },
    "startup":  {
                    "contractVersion":  "unknown",
                    "ready":  false,
                    "checkpoints":  [

                                    ]
                },
    "environment":  {
                        "class":  "unknown",
                        "os":  "windows"
                    },
    "privilege":  {
                      "class":  "restricted"
                  },
    "networking":  {
                       "port":  8080,
                       "portOwnership":  "service"
                   },
    "probeResults":  {
                         "startupProbe":  "fail",
                         "smokeProbe":  "fail"
                     },
    "governance":  {
                       "decision":  "deny",
                       "reasonCode":  "schema_invalid"
                   }
}